{
  "schema": "ontogony-system-protocol-registry-v1",
  "baseline": "SYSTEM-ALPHA-005",
  "generatedAt": "2026-05-20",
  "repos": [
    {
      "name": "ontogony-platform",
      "role": "shared mechanics / protocol registry",
      "ref": "main",
      "commit": "TBD-current-or-locked"
    },
    {
      "name": "allagma-dotnet",
      "role": "governed runtime / lock owner",
      "ref": "main",
      "commit": "TBD-current-or-locked"
    },
    {
      "name": "kanon-dotnet",
      "role": "semantic authority",
      "ref": "main",
      "commit": "TBD-current-or-locked"
    },
    {
      "name": "conexus-dotnet",
      "role": "model gateway",
      "ref": "main",
      "commit": "TBD-current-or-locked"
    }
  ],
  "protocols": [
    {
      "id": "runtime-lock",
      "ownerRepo": "allagma-dotnet",
      "kind": "runtime-lock",
      "paths": [
        "docs/system/ontogony-runtime.lock.json"
      ],
      "validators": [
        "scripts/validate-runtime-lock.ps1"
      ]
    },
    {
      "id": "kanon-routes",
      "ownerRepo": "kanon-dotnet",
      "kind": "route",
      "paths": [
        "docs/generated/ONTOLOGY_V0_ROUTE_INVENTORY.json",
        "docs/api/kanon-openapi-v1.json"
      ]
    },
    {
      "id": "cross-service-error",
      "ownerRepo": "ontogony-platform",
      "kind": "error",
      "paths": [
        "src/Ontogony.Errors",
        "tests/Ontogony.PublicApi.Tests/...Ontogony.Errors.verified.txt"
      ]
    }
  ],
  "evidence": [
    {
      "id": "SYSTEM-ALPHA-005",
      "path": "allagma-dotnet/docs/evidence/SYSTEM_ALPHA_005_CLOSEOUT.md",
      "verdict": "PASS_WITH_QUARANTINE"
    }
  ],
  "quarantines": [
    {
      "id": "B-012",
      "status": "open",
      "rationale": "Grafana readiness blocked Docker OTLP live gate",
      "followup": "SYS-OBS-004A"
    }
  ]
}
